issn,nom_clt,nb_numeros,nb_document,pre_année_pub,der_année_pub,discpline,editeur
2262-3353,Hommes & Migrations,180.0,4523.0,1987.0,2008.0,"démographie, science politique",Musée de l'Histoire de l'Immigration
1950-6694,Revue économique,320.0,6776.0,1950.0,2002.0,économie,SciencesPo
1783-1768,Revue Philosophique de Louvain,441.0,12292.0,1894.0,2015.0,philosophie,Peeters
1957-7966,Population,320.0,12794.0,1946.0,2004.0,démographie,INED (Institut national d’études démographiques)
1777-5418,Revue Européenne des Migrations Internationales,49.0,814.0,1985.0,2001.0,démographie,MSH Poitiers
1950-6678,Vingtième Siècle. Revue d'histoire,72.0,3370.0,1984.0,2001.0,histoire,Presses de Sciences Po
1778-7459,Communication & Langages,174.0,3039.0,1962.0,2008.0,"linguistique, sciences de l'information et de la communication, sociologie",NecPlus
1782-1517,Revue d'économie du développement,31.0,203.0,1993.0,2001.0,Economie,De Boeck Supérieur
1963-1359,Revue Tiers Monde,181.0,5775.0,1960.0,2006.0,"économie, science politique",Armand Colin
2275-5195,Bulletin de l'Association de Géographes Français,445.0,3746.0,1924.0,2012.0,"géographie, science de l'environnement",Association de Géographes Français
1777-5469,Bulletins et Mémoires de la Société d'Anthropologie de Paris,289.0,7029.0,1864.0,1999.0,"anthropologie, archéologie (mondes anciens)",Société d'anthropologie de Paris
2104-3752,Espace Populations Sociétés,58.0,1311.0,1983.0,2003.0,"géographie, démographie",Université des sciences et techniques de Lille
1958-5691,Revue française de sociologie,184.0,4287.0,1960.0,2002.0,sociologie,Ophrys
1958-8992,Politique étrangère,314.0,8612.0,1936.0,2005.0,science politique,Institut Français des Relations Internationales
1703-7891,Études internationales,192.0,242.0,1970.0,2019.0,"Droit, Économie, Sciences politiques",Institut québécois des hautes études internationales
2540-2544,Revue des Études Anciennes,283.0,11655.0,1899.0,2003.0,"arts, études classiques, histoire",Presses Universitaires de Bordeaux
1492-1405,Études françaises,161.0,216.0,1965.0,2019.0,Études littéraires,Les Presses de l’Université de Montréal
1708-9069,Études littéraires,135.0,186.0,1968.0,2020.0,Études littéraires,"Département de littérature, théâtre et cinéma de l’Université Laval"
1710-0305,Tangence,85.0,113.0,1992.0,2019.0,Études littéraires,Tangence
2105-2956,Quaderni,64.0,861.0,1987.0,2008.0,science politique,Éditions de la MSH
2117-718,Revue des Études Slaves,183.0,3864.0,1921.0,2012.0,études des grandes aires culturelles,Institut d'études slaves
2111-4412,Chimères. Revue des schizoanalyses,57.0,941.0,1987.0,2006.0,"Anthropologie, Philosophie, Psychologie, Science politique, Sociologie",Association Chimères
1705-4591,Revue québécoise de linguistique,44.0,67.0,1981.0,2003.0,Études des langues,Université du Québec à Montréal
2259-6100,Revue d'études comparatives Est-Ouest,149.0,1800.0,1970.0,2008.0,"économie, science politique",NecPlus
2613-2702,Horizons Maghrébins - Le droit à la mémoire,48.0,1620.0,1984.0,2010.0,"Anthropologie, Arts (Histoire de l'art, Architecture), Littérature",Presses Universitaires du Midi
1705-6225,Recherches sociographiques,162.0,222.0,1960.0,2019.0,Sociologie,"Département de sociologie, Faculté des sciences sociales, Université Laval"
,,,,,,,
2513-6119,Espace Temps,52.0,1003.0,1975.0,2005.0,"géographie, science de l'environnement",Association Espace Temps
2102-5924,Communications,105.0,1655.0,1961.0,2019.0,"science politique, science de l'information et de la communication, sociologie",Le Seuil
1705-6500,Cinémas,58.0,87.0,1990.0,2018.0,Arts,Cinémas
1958-5926,Littérature,140.0,1891.0,1971.0,2005.0,"arts (histoire de l'art, architecture), littérature",Armand Colin
1703-7921,Anthropologie et Sociétés,119.0,163.0,1976.0,2019.0,Anthropologie et ethnologie,Département d’anthropologie de l’Université Laval
2105-2581,Économie rurale,263.0,3329.0,1949.0,2004.0,"économie, sociologie",Societé française d'économie rurale
1953-8111,Revue internationale de droit comparé,274.0,12914.0,1949.0,2016.0,droit,Société de législation comparée
1969-6981,Enfance,188.0,2040.0,1948.0,2000.0,"psychologie, science de l'éducation",Presses Universitaires de France
2107-0946,Formation Emploi,91.0,3714.0,1983.0,2005.0,"démographie, science de l'éducation, sociologie",La Documentation Française
2261-060,Revue des études byzantines,263.0,9328.0,1897.0,2014.0,études des grandes aires culturelles,Institut français d'études byzantines
1953-812,Revue de l'Art,60.0,1346.0,1985.0,1999.0,art,Éditions Ophrys
1996-4609,Perspectives Chinoises,108.0,1840.0,1992.0,2010.0,"démographie, science politique, sociologie",CEFC
1492-1391,Philosophiques,92.0,138.0,1974.0,2019.0,Philosophie,Société de philosophie du Québec
2261-4427,Annales de Normandie,343.0,3988.0,1951.0,2009.0,"études régionales, histoire",Centre de recherche d'histoire quantitative
1703-8480,Politique et Sociétés,65.0,90.0,1995.0,2019.0,Sciences politiques,Société québécoise de science politique
2101-0226,L'Homme et la société,91.0,2974.0,1966.0,2000.0,"anthropologie, démographie, sociologie",L'Harmattan
1705-1495,Cahiers québécois de démographie,95.0,139.0,1975.0,2018.0,Démographie,Association des démographes du Québec
1961-8603,Les Cahiers d'Outre-Mer,214.0,2585.0,1948.0,2001.0,géographie,Presses Universitaires de Bordeaux
1777-5396,"CEMOTI, Cahiers d'Études sur la Méditerranée Orientale et le monde Turco-Iranien",38.0,870.0,1985.0,2005.0,sciences politiques,Centre d'études et de recherches internationales (Paris).
2613-2737,Travaux de l'Institut de Géographie de Reims,73.0,664.0,1969.0,2007.0,géographie,Equipe de recherche Habiter (EA 2076).
2419-8676,Le Monde alpin et rhodanien. Revue régionale d’ethnologie,65.0,1114.0,1973.0,2005.0,"anthropologie, études régionales, histoire",Centre alpin et rhodanien d’ethnologie
1775-3821,Bulletin hispanique,324.0,7355.0,1899.0,2007.0,"étude des grandes aires culturelles, histoire",Presses universitaires de Bordeaux
1957-7958,Romantisme,127.0,3089.0,1971.0,2006.0,littérature,Armand Colin
2118-724,Spirale - Revue de recherches en éducation,69.0,1057.0,1989.0,2016.0,sciences de l'éducation,Association de pédagogie et de didactique de l'Ecole normale de Lille
1708-8968,Cahiers de géographie du Québec,174.0,237.0,1956.0,2018.0,Géographie,Département de géographie de l’Université Laval
2101-0382,Langage & société,95.0,1737.0,1977.0,1999.0,"linguistique, sociologie",Maison des Sciences de l'Homme
2105-2913,Revue française de pédagogie,153.0,3142.0,1967.0,2005.0,sciences de l'éducation,ENS éditions
1969-6582,Revue d'histoire des sciences,207.0,4093.0,1947.0,2006.0,histoire des sciences et des techniques,Armand Colin
1955-2580,L'Année psychologique,212.0,7026.0,1894.0,2008.0,"psychologie, science de l'éducation",Armand Colin
1705-9240,Recherches féministes,63.0,95.0,1988.0,2019.0,Études féministes,Revue Recherches féministes
1703-9665,Lien social et Politiques,52.0,78.0,1994.0,2019.0,"Sciences politiques, Sociologie",Lien social et Politiques
1710-3991,L'Actualité économique,240.0,304.0,1955.0,2018.0,Économie,HEC Montréal
1760-7426,Revue de Géographie Alpine,366.0,5315.0,1913.0,2006.0,géographie,"Association pour la Diffusion
de la Recherche Alpine"
1918-7750,Scientia Canadensis,47.0,79.0,1985.0,2019.0,Histoire,CSTHA/AHSTC
2261-1010,Autres Temps,77.0,1437.0,1984.0,2003.0,"philosophie, religion et théologie, sociologie",Association Autre Temps
2497-7098,Les Annales de la Recherche Urbaine,101.0,2569.0,1978.0,2018.0,"arts (histoire de l'art, architecture), géographie, sociologie",Plan - Urbanisme - Construction – Architecture
1953-8146,Annales,334.0,14228.0,1929.0,2002.0,"histoire, économie",Éditions de l'EHESS
1776-3045,Revue d’Histoire Moderne & Contemporaine,362.0,7292.0,1899.0,2000.0,histoire,"Société d'histoire moderne et contemporaine, Editions Belin"
1492-1375,Sociologie et sociétés,100.0,150.0,1969.0,2018.0,Sociologie,Les Presses de l’Université de Montréal
1773-0201,Cahiers de la Méditerranée,66.0,801.0,1970.0,2000.0,,
1777-5809,Réseaux. Communication - Technologie - Société,126.0,1876.0,1983.0,2000.0,"sciences de l'information et de la communication, sociologie",La découverte
1775-3945,"Santé, Société et Solidarité",18.0,360.0,2002.0,2010.0,"économie, science politique",Institut de Recherche et Documentation en Économie de la Santé
1777-5795,Économie & prévision,181.0,1421.0,1971.0,2017.0,"économie, science politique, sociologie",INSEE
2647-8145,Annuaire international de justice constitutionnelle,34.0,1404.0,1987.0,2018.0,Droit,"Economica, Presses Universitaires d'Aix-Marseille"
1955-2564,Actes de la Recherche en Sciences Sociales,121.0,1477.0,1975.0,2003.0,"économie, histoire, science politique, sociologie",Le Seuil
2551-3761,Cahier Louis-Lumière,9.0,138.0,2003.0,2015.0,"arts (Histoire de l'art, Architecture), sciences de l'information et de la communication",Ecole nationale supérieure Louis-Lumière
1957-7850,Journal des Africanistes,124.0,2289.0,1931.0,2003.0,"anthropologie, études des grandes aires culturelles",Société des africanistes
1776-2936,L'Espace géographique,113.0,2566.0,1972.0,2000.0,"géographie, science de l'environnement",Belin
1773-0198,Revue d'économie industrielle,112.0,1424.0,1977.0,2005.0,économie,Éditions techniques et économiques
2119-4831,Politiques et Management Public,101.0,1377.0,1983.0,2007.0,"économie, science politique",Lavoisier
1952-4226,Matériaux pour l'histoire de notre temps,66.0,1461.0,1985.0,2005.0,histoire,Association des amis de la BDIC
2105-2573,Revue de l'histoire des religions,228.0,5550.0,1946.0,2004.0,"histoire, religion et théologie",Armand Colin
2117-590,XVII-XVIII. Revue de la Société d'études anglo-américaines des XVIIe et XVIIIe siècles,83.0,1309.0,1975.0,2011.0,études des grandes aires culturelles,Société des études anglo-américaines des XVIIe et XVIIIe siècles
2105-2948,Annuaire Français de Droit International,65.0,3163.0,1955.0,2014.0,"droit, science politique",CNRS Éditions
1777-5329,Revue d'Histoire du XIXe siècle - 1848,191.0,2769.0,1904.0,1999.0,Histoire,Société de 1848
1760-7388,Revue française d'économie,96.0,940.0,1986.0,2010.0,économie,Association Française d'Économie
2259-0285,Revue des Sciences Religieuses,281.0,7938.0,1921.0,2005.0,"études classiques, histoire, religion et théologie",Faculté de Théologie Catholique de Strasbourg
1777-5574,Economie et Statistique,685.0,4913.0,1946.0,2019.0,"économie, science politique, sociologie",INSEE
1777-5744,Revue d'économie financière,121.0,2693.0,1987.0,2012.0,économie,Association d'Économie Financière
1760-7256,Journal de la Société des Océanistes,89.0,2019.0,1945.0,2000.0,"anthropologie, études des grandes aires culturelles",Société des océanistes
2613-2958,Publications de la Société Linnéenne de Lyon,901.0,9194.0,1836.0,2015.0,"Science de l'environnement, Science de la Terre, Science de la vie",Société Linnéenne de Lyon
2262-0753,Les cahiers du GRIF,50.0,1865.0,1973.0,1997.0,"histoire, psychologie, sociologie",Groupe de recherche et d'information féministes
1950-6686,Revue française de science politique,281.0,5601.0,1951.0,2003.0,science politique,SciencesPo
1953-8138,Bibliothèque de l'École des chartes,224.0,16690.0,1840.0,2013.0,"études classiques, histoire",Société de l'École des Chartes
1969-6663,Comptes rendus des séances de l'Académie des Inscriptions et Belles-Lettres,683.0,25966.0,1857.0,2014.0,"archéologie, études classiques, histoire",Académie des Inscriptions et des Belles Lettres
2419-686,Bulletin de Minéralogie,434.0,6329.0,1878.0,1988.0,"Sciences de la Terre, Sciences de la vie, Littérature",Société Française de Minéralogie et de Cristallographie
2271-7005,Revue du Nord,325.0,7490.0,1910.0,2000.0,"archéologie (mondes anciens), études régionales, histoire",Université Lille 3
1488-9692,Circuit,74.0,104.0,1990.0,2019.0,Arts,"Circuit, musiques contemporaines"
2417-6516,"Albineana, Cahiers d'Aubigné",29.0,499.0,1988.0,2017.0,littérature,Association des amis d'Agrippa d'Aubigné
2272-9828,Caravelle. Cahiers du monde hispanique et luso-brésilien,88.0,3509.0,1963.0,2007.0,"anthropologie, histoire, littérature",Presses Universitaires du Mirail
1760-8546,Norois,181.0,3790.0,1954.0,2002.0,"études régionales, géographie, science de l'environnement",Presses universitaires de Rennes
1775-3864,Revue d'Histoire de la Pharmacie,399.0,13711.0,1913.0,2017.0,histoire des sciences et des techniques,Société d'histoire de la pharmacie
2507-0185,Revue d'Histoire des Textes,45.0,583.0,1953.0,2003.0,"études classiques, histoire, littérature",Institut de Recherche et d'Histoire des Textes
1764-7223,Sciences et Technologies de l'Information et de la Communication pour l'Éducation et la Formation,48.0,822.0,1994.0,2018.0,Science de l'éducation,"Le Mans Université, LIUM"
2295-9068,Revue belge de Philologie et d'Histoire,349.0,20852.0,1922.0,2017.0,"histoire, linguistique",Société pour le Progrès des Études Philologiques et Historiques
2496-7068,Annales du Midi,465.0,7669.0,1889.0,2014.0,"archéologie (mondes anciens), études classiques, histoire",Éditions Privat
1920-7344,Communication. Information Médias Théories,43.0,855.0,1975.0,1998.0,sciences de l'information et de la communication,Département d'information et communication de l'Université Laval
1492-1383,Revue d’histoire de l’Amérique française,277.0,350.0,1947.0,2019.0,Histoire,Institut d’histoire de l’Amérique française
1705-0065,Revue des sciences de l’éducation,136.0,181.0,1975.0,2019.0,Éducation,Revue des sciences de l’éducation
1777-5884,Annales de géographie,632.0,16093.0,1892.0,2006.0,"géographie, sociologie, science de l'environnement",Armand Colin
2547-5614,Hommes et Terres du Nord,129.0,2052.0,1963.0,2004.0,"études régionales, géographie",Société de Géographie de Lille
2105-2271,Revue des mondes musulmans et de la Méditerranée,72.0,2118.0,1966.0,1999.0,études des grandes aires culturelles,Presses universitaires de Provence
1776-2774,Annales de Démographie Historique,41.0,1811.0,1964.0,2001.0,"anthropologie, démographie, histoire",Société de Démographie Historique
1950-6899,Sociétés Contemporaines,35.0,749.0,1990.0,2000.0,"science politique, sociologie",SciencesPo
2275-5039,Bulletin Monumental,351.0,16295.0,1885.0,2016.0,"archéologie, arts, histoire",Éditions Picard
2108-6443,Annales de Bretagne et des pays de l'Ouest,296.0,4101.0,1902.0,2000.0,"archéologie (mondes anciens), études régionales, histoire",Presses universitaires de Rennes
1968-3758,Agora débats/jeunesses,42.0,2375.0,1995.0,2006.0,"démographie, science de l'éducation, science politique",Presses SciencesPo
1776-3061,Revue Française d'Études Américaines,69.0,2578.0,1978.0,2000.0,"arts (histoire de l'art, architecture), études des grandes aires culturelles",Belin
1960-601,Géocarrefour,263.0,4124.0,1926.0,2002.0,"géographie, science de l'environnement",Association des amis de la Revue de Géographie de Lyon
2272-7639,Pallas. Revue d'études antiques,55.0,668.0,1953.0,1999.0,"archéologie, histoire, littérature",Presses Universitaires du Midi
1777-537,Études rurales,102.0,2589.0,1961.0,1999.0,"anthropologie, histoire",Éditions de l'EHESS
2273-0257,Revue géographique des Pyrénées et du Sud-Ouest. Sud-Ouest Européen,257.0,3604.0,1930.0,2008.0,géographie,Presses Universitaires du Mirail
2264-7791,Cahiers de l'APLIUT,75.0,1908.0,1980.0,2000.0,"linguistique, science de l'éducation",Association des professeurs de langues des Instituts universitaires de technologie (l’APLIUT)
2111-4528,Culture & Musées,40.0,576.0,1992.0,2014.0,sciences de l'information et de la communication,"Actes Sud, Université d'Avignon"
1957-7842,Journal de la société des américanistes,107.0,5241.0,1895.0,2000.0,"anthropologie, études des grandes aires culturelles",Société des américanistes
1760-7892,Dix-Huitième Siècle,37.0,9590.0,1969.0,2005.0,"arts, histoire de l'art, histoire, littérature",Société Française d’Etude du Dix-Huitième Siècle
1777-5906,"Histoire, économie & société",100.0,1799.0,1982.0,2006.0,"économie, histoire , sociologie",Armand Colin
1492-1413,Théologiques,49.0,76.0,1993.0,2019.0,Théologie,Institut d’études religieuses de l’Université de Montréal
1703-8138,Relations industrielles / Industrial Relations,323.0,398.0,1945.0,2019.0,Relations industrielles,Département des relations industrielles de l’Université Laval
2109-9502,Revue d'histoire de l'Église de France,221.0,3850.0,1910.0,2000.0,"histoire, religion et théologie",Société d'histoire religieuse de France
1953-8286,Politix. Revue des sciences sociales du politique,65.0,1491.0,1988.0,2004.0,"science politique, sociologie",De Boeck
1960-6656,Pôle Sud,25.0,556.0,1994.0,2006.0,science politique,Observatoire des Politiques Publiques en Europe du Sud
1969-654,"Réforme, Humanisme, Renaissance",80.0,2172.0,1975.0,2014.0,,"Association d'étude sur l'Humanisme, la Réforme et le Renaissance"
2275-5160,Bulletin de l'Association Guillaume Budé,317.0,5269.0,1923.0,2016.0,"archéologie (mondes anciens), études classiques, littérature","Les Belles lettres, Association Guillaume Budé"
1777-5825,Archives de Sciences Sociales des Religions,134.0,14426.0,1956.0,1999.0,"anthropologie, religion et théologie, sociologie",Éditions de l'EHESS
1953-8103,Homme,136.0,5959.0,1961.0,1999.0,"anthropologie, science de l'environnement",Éditions de l'EHESS
2114-2203,Journal des anthropologues,51.0,1030.0,1979.0,1997.0,anthropologie,Association française des anthropologues
2647-8463,Nouvelle revue d'onomastique,33.0,1520.0,1983.0,2015.0,"histoire, linguistique",Société française d’onomastique
2496-7467,La Revue russe,40.0,766.0,1991.0,2013.0,"études des grandes aires culturelles, littérature",Institut d'études slaves
1960-6001,Mots. Les langages du politique,69.0,1791.0,1980.0,2002.0,"linguistique, science politique, science de l'information et de la documentation",ENS Éditions
1777-5647,Revue de l'OFCE,75.0,1381.0,1982.0,2000.0,économie,SciencesPo
1777-554,Critique internationale,9.0,376.0,1998.0,2000.0,"démographie, sociologie",Presses SciencesPo
1777-5876,L'Information Géographique,177.0,4630.0,1936.0,2005.0,"géographie, science de l'éducation",Armand Colin
2497-6784,Cahiers Edmond et Jules de Goncourt,23.0,842.0,1992.0,2016.0,"arts (histoire de l'art, architecture), histoire, littérature",Société des Amis des frères Goncourt
1957-7982,Langue française,152.0,1768.0,1969.0,2006.0,"arts (histoire de l'art, architecture), linguistique",Armand Colin
2259-8863,Etudes irlandaises,67.0,2090.0,1976.0,2008.0,"études des grandes aires culturelles, histoire, littérature",Presses Universitaires de Rennes
1969-6779,Cahiers d'Économie Politique,31.0,728.0,1974.0,2001.0,"économie, science politique",L'Harmattan
1712-2139,Revue de l’Université de Moncton,26.0,41.0,2004.0,2018.0,Sciences humaines et sociales,Revue de l’Université de Moncton
2295-9076,L'Antiquité Classique,124.0,20273.0,1932.0,2014.0,"arts (histoire de l'art, architecture), études classiques, histoire",Association L'Antiquité classique
1960-6648,Mil neuf cent. Revue d'histoire intellectuelle (Cahiers Georges Sorel),18.0,464.0,1983.0,2000.0,"études classiques, histoire",Société d'études soréliennes
1777-5892,Médiévales,41.0,845.0,1982.0,2002.0,"études classiques, histoire, littérature",Presses Universitaires de Vincennes
1920-2954,Horizons philosophiques,34.0,52.0,1990.0,2007.0,Philosophie,Collège Édouard-Montpetit
2297-5810,Le Globe. Revue genevoise de géographie,165.0,4574.0,1860.0,2019.0,"géographie, science de l'environnement",Société de Géographie de Genève
1638-1580,Histoire Épistémologie Langage,99.0,1449.0,1979.0,2017.0,"histoire, linguistique",Société d'histoire et d'Épistémologie des Sciences du Langage
1775-383,Journal des Savants,487.0,5139.0,1909.0,2016.0,"arts (histoire de l'art, architecture), études classiques, histoire",Académie des Inscriptions et des Belles-Lettres
1760-7361,Bulletin de la Société préhistorique française,930.0,9438.0,1904.0,2017.0,"anthropologie, archéologie (mondes anciens)",Société préhistorique française
1955-2416,Recherches sur Diderot et sur l'Encyclopédie,26.0,953.0,1986.0,2002.0,littérature,Société Diderot
2427-9048,América. Cahiers du CRICCAL,41.0,1005.0,1986.0,2013.0,"littérature, étude des grandes aires culturelles",Presses Sorbonne Nouvelle
2613-2729,Géologie Méditerranéenne,85.0,794.0,1974.0,2001.0,"Sciences de la Terre, Sciences de la vie",Éditions de l'Université de Provence
2119-1026,Cahiers de Civilisation Médiévale,192.0,4980.0,1958.0,2007.0,"archéologie (mondes anciens), arts (histoire de l'art, architecture), histoire",Centre d’études supérieures de civilisation médiévale
2260-815,Monuments et mémoires de la Fondation Eugène Piot,116.0,914.0,1894.0,2015.0,"art, études classiques, histoire",Académie des Inscriptions et Belles-Lettres
2273-0311,Littératures,85.0,2079.0,1951.0,2009.0,Littérature,Presses Universitaires du Midi
2108-6478,Revue Géographique de l'Est,107.0,1348.0,1961.0,1998.0,"études régionales, géographie",Association des géographes de l'Est
2260-8079,Revue des Études Grecques,343.0,14260.0,1888.0,2016.0,études classiques,Association des Études Grecques
1969-6973,Droit et Société,38.0,1892.0,1985.0,2000.0,"droit, science politique, sociologie",Lextenso
2102-5940,Annuaire des Collectivités Locales,36.0,1463.0,1981.0,2016.0,"droit, science politique, sociologie",Université Paris 1 Panthéon Sorbonne
1965-0795,Quaternaire,129.0,1244.0,1964.0,2004.0,"géographie, science de l'environnement",Association Française pour l'Étude du Quaternaire
1958-9549,Langages,164.0,1644.0,1966.0,2006.0,linguistique,Armand Colin
1776-2944,Genèses. Sciences sociales et histoire,43.0,1256.0,1990.0,2000.0,"anthropologie, histoire, sciences politiques",Belin
2647-9982,Villes en Parallèle,38.0,677.0,1978.0,2018.0,Géographie,"Université Paris10-Nanterre, Laboratoire de géographie urbaine"
2613-2710,Débats Jeunesses,25.0,237.0,1996.0,2010.0,Sociologie,"Université Libre de Bruxelles, Département de Traduction et Interprétation"
2647-7300,Cahiers du Centre d’Études Chypriotes,45.0,667.0,1984.0,2016.0,"archéologie, arts (histoire de l'art, architecture), histoire",Association «Centre d'Etudes Chypriotes» {C}{C}{C}
2260-8478,Littératures classiques,60.0,1156.0,1979.0,2005.0,"Histoire, Littérature",Presses universitaires du Midi
2431-210,"NETCOM : Réseaux, communication et territoires / Networks and communication studies",42.0,687.0,1987.0,2006.0,"Géographie, Sciences de l'information et de la communication, Sociologie",Association NETCOM
1968-3936,Recherche & formation,50.0,1019.0,1987.0,2005.0,science de l'éducation,"ENS Éditions, Institut Français de l'Éducation"
1952-403,Annales historiques de la Révolution française,159.0,3626.0,1963.0,2008.0,histoire,Armand Colin
1777-5701,Sociologie du travail,159.0,2357.0,1959.0,1998.0,Sociologie,Association pour le développement de la sociologie du travail
1783-1830,Vita Latina,74.0,854.0,1989.0,2017.0,études classiques,Les Belles Lettres
2946-7564,Revue Juridique de l'Ouest,194.0,2905.0,1973.0,2018.0,droit,Institut de l'Ouest : Droit et Europe
2540-3494,Bulletin de la Société nationale des Antiquaires de France,63.0,4262.0,1945.0,2016.0,"Archéologie, Arts (Histoire de l'art, Architecture), Histoire",Société nationale des Antiquaires de France
2490-7944,Revue des politiques sociales et familiales,124.0,1665.0,1985.0,2019.0,"économie, science politique, sociologie",CNAF
2425-2042,Pratiques,111.0,1066.0,1974.0,2007.0,"Linguistique, Science de l'éducation",CREM (Centre de Recherche sur les Médiations)
1777-5353,Cahiers d'Études africaines,130.0,3102.0,1960.0,1999.0,"anthropologie, étude des grandes aires culturelles, histoire",Éditions de l'EHESS
2111-4552,Arts Asiatiques,68.0,1301.0,1962.0,2019.0,"archéologie (mondes anciens), arts (histoire de l'art, architecture), étude des grandes aires culturelles",École france d'Extrême-Orient
2513-6097,Revue Européenne de Droit de l’Environnement,50.0,951.0,1997.0,2009.0,"droit, science de l'environnement",Centre International de Droit Comparé de l'Environnement (C.I.D.C.E.)
2275-4776,GAIA. Revue interdisciplinaire sur la Grèce ancienne,19.0,448.0,1997.0,2017.0,"archéologie (mondes anciens), études classiques, histoire",Éditions littéraires et linguistiques de l'université de Grenoble (ELLUG)
2118-9692,LINX,43.0,578.0,1979.0,1997.0,linguistique,Université Paris Ouest La Défense
1955-270,Dialogues d'histoire ancienne,93.0,2667.0,1974.0,2018.0,"archéologie (mondes anciens), études classiques, histoire",Institut des sciences et techniques de l'Antiquité
1760-737,Bulletin de l'École française d'Extrême-Orient,118.0,3784.0,1901.0,2018.0,"archéologie (mondes anciens), étude des grandes aires culturelles, histoire",École française d'Extrême-Orient
1760-8538,Méditerranée,141.0,2053.0,1960.0,2004.0,"géographie, science de l'environnement",Presses universitaires de Provence
1492-1367,Criminologie,88.0,133.0,1975.0,2019.0,"Droit, Sociologie",Les Presses de l’Université de Montréal
2117-6809,Actes des congrès de la Société des historiens médiévistes de l'enseignement supérieur public,38.0,765.0,1970.0,2007.0,histoire,Publications de la Sorbonne
1783-8401,Revue Théologique de Louvain,176.0,7882.0,1970.0,2013.0,"religion et théologie, arts (histoire de l'art, architecture), études classiques,",Publications de l'Université catholique de Louvain
2296-4096,Déviance et société,96.0,1095.0,1977.0,2000.0,"démographie, psychologie, sociologie",Médecine et Hygiène
