,num_doc,title,type,annee_publication,num_publication,texte,eissn
0,1,La fuite des cerveaux : le cas de l'ex-URSS,article,1992,1155,"La fuite des cerveaux : le cas de l'ex-URSS..., 1 '""exode inté¬ rieur"" ne cesse de s'accélérer. 2 Selskaia Jizn, 25 janvier 1992. 3. Trud, 30 janvier 1992. Les domaines particulièrement touchés par la fuite des cerveaux sont la physique des solides... peu de personnes et ne constitue pas un cas typique de fuite des cerveaux. Il semble clair que cette fuite est un problème complexe, qui ne peut être résolu par des mesures simples. Il est important... facile de parvenir à une véritable coopération inter¬ nationale en matière d'immigration en général que sur la question de la fuite des cerveaux. Il est vrai que certaines observations faites",2262-3353
1,2,"Croissance, redistribution et inégalités dans un modèle de fuite des cerveaux",article,1999,50-3,"Croissance, redistribution et inégalités dans un modèle de fuite des cerveaux Dans cet article, nous étudions dans un cadre analytique unifié l'effet global de la fuite des cerveaux... de fuite des cerveaux peut s'avérer favorable à la croissance et/ou à la réduction des inégalités selon l'ampleur de la redistribution et l'importance des mouvements migratoires. Nous endogénéisons ensuite...Croissance, redistribution et inégalités dans un modèle de fuite des cerveaux...Croissance redistribution et inégalités dans un modèle de fuite des cerveaux Frédéric Docquier Hillel Rapoport* CADRE Université Lille II et SES ministère de la région wallonne ** Department of... des plus qualifiés phénomène communément désigné sous le terme de fuite des cerveaux Dans un premier temps la position traditionnelle de Bhagwati et Hämada 1974] assimilant la fuite des cerveaux... soit élitistes soit progressistes où obtention de privilèges est conditionnée par appartenance un groupe spécifique Au total il apparaît que lorsque la fuite des cerveaux est le moteur de la croissance les",1950-6694
2,3,Que nous devons-nous les uns aux autres ? Le cas de la «fuite des cerveaux»,article,2008,106-4,"La fuite des cerveaux est-elle un phénomène individuellement légitime, mais socialement fâcheux ou bien enveloppe-t-elle une forme d’injustice à l’égard des populations qui en subissent les effets... ? Nous construisons un modèle simplifié de ce phénomène permettant de faire apparaître ce qu’il y a d’éthiquement problématique dans la fuite des cerveaux et quels types de remèdes pourraient y être apportés....Que nous devons-nous les uns aux autres ? Le cas de la «fuite des cerveaux»...Que nous devons-nous les uns aux autres? Le cas de la «fuite des cerveaux»1 Si la mondialisation économique contemporaine est d’intérêt phi¬ losophique, et pas seulement économique et politique... de la «fuite des cerveaux», sur lequel nous voudrions nous pencher ici, nous semble une assez bonne illustration de cette contribution involontaire de la mondialisa¬ tion économique au développement... et au raffinement de nos théories éthiques : la fuite des cerveaux engendre des dommages dont on ne peut d’emblée déterminer s’ils sont aussi des préjudices, ce qui nous oblige à préciser ou raffiner nos théories",1783-1768
3,4,Chorafas Dimitri N. — La fuite des cerveaux. Les U.S.A. à la conquête de nos savants,compte-rendu,1970,25-5,"Chorafas Dimitri N. — La fuite des cerveaux. Les U.S.A. à la conquête de nos savants...Chorafas Dimitri N. La fuite des cerveaux. Les U.S.A. à la conquête de nos savante. Traduit de l'anglais par Claude Herbette. [Paris], Fayard [1969], 22 cm, 189 p. Bien qu'il parle... de « nous, européens », c'est le point de vue américain que C. exprime dans son ouvrage. Après avoir mis en évidence l'importance de la fuite des « cerveaux » européens, spécialement de Grande-Bretagne et des pays..., le ralentissement de l'économie américaine et du recrutement organisé par certaines entreprises, semble avoir fortement abaissé le départ des « cerveaux » et favorisé plus de retours en Europe que les efforts",1957-7966
4,5,Au-delà de la « fuite des cerveaux » : la mobilité des personnes hautement qualifiées de l'ouest vers la Pologne,article,1997,13-1,"Au-delà de la « fuite des cerveaux » : la mobilité des personnes hautement qualifiées de l'ouest vers la Pologne... à la mobilité de personnes qualifiées et de cadres dirigeants vers l'Europe centrale et de l'est une qualité différente des processus historiques de fuite des cerveaux. La fuite des cerveaux : le départ...Revue Européenne des Migrations Internationales, 1997 (13) 1 pp. 71-92 71 Au-delà de la « fuite des cerveaux » : la mobilité des personnes hautement qualifiées de l'ouest vers la Pologne Félicitas... et orientale, s'intéressaient plus particulièrement aux scientifiques, chercheurs et autres experts. On parla alors de fuite des cerveaux. De fait, le potentiel scientifique polonais diminua d'un quart entre",1777-5418
