num_doc,title,annee_publication,issn
5390,L’Europe des valeurs communes et le recul du multiculturalisme : la diversité supplantée par l’unité ?,2011,1783-1768
5391,Nouveaux Xantholininae d'Europe centrale et de la région méditerranéenne [Col. Staphylinidae],1956,
5392,Les principaux Insectes nuisibles importés d’Europe aux États-Unis,1905,
5393,"Genre, ethnicité, race et migrations : ou les défis de la citoyenneté en Europe",1998,
5394,Leszek Garlicki : La justice constitutionnelle en Europe occidentale 1987,1989,2647-8145
5395,Antonio Perotti Migrations et société pluriculturelle en Europe,1997,2262-3353
5396,"La France, l'Europe et leurs «modèles d'intégration». Une allocution de Claude Evin",1990,2262-3353
5397,Epipaléolithique - Mésolithique. Les derniers chasseurs d'Europe occidentale (13000-5500 av. J.-C.),1999,1760-7361
5398,"J.-L. Déotte, Oubliez! Les ruines, l'Europe, le musée",1994,2111-4528
5399,Le nationalisme et la protection des droits de l'Homme : la Conférence sur la Sécurité et la Coopération en Europe,1991,
5400,La lutte contre le racisme en Europe : I - Les instruments internationaux,1995,1777-5418
5401,"Alexandre Del Valle, Guerres contre l'Europe",2001,2262-3353
5402,Science et affaires : l'Europe ne restera pas en retard dans l'étude du génome humain,1988,
5403,"Karst et mines en France et en Europe : gîtes, grottes-mines et géotechnique",1996,2546-9002
5404,Grottes d'Europe centrale dans les Encyclopédies françaises du XVIIIe siècle,2006,2546-9002
5405,"Terrorisme, drogue, immigration : les nouvelles figures de l’insécurité en Europe",1993,1703-9665
5406,Le contrôle juridictionnel de la constitutionnalité des lois dans les pays d'Europe occidentale,1987,2647-8145
5407,Turcs d'Europe : de l'image tronquée à la complexité d'une réalité sociale immigrée,2000,2262-3353
5408,"L'Europe, «fabrique de l'interculturel » Institutions bi-ou plurinationales et leurs travaux",2008,2262-3353
5409,Le quartier urbain en Europe (XVIII-XIX siècle). Approches et réalités,1993,
5410,Captures et élevages de larves de Coléoptères aquatiques. Dytiscides de l'Europe méridionale,1956,
5411,Un nouveau Xantholinus d'Europe centrale [Col. Staphylinidae],1955,
5412,Description d'un Soronia nouveau d'Europe [Col. Nitidulidae],1923,
5413,Quelques problèmes récents d'archéologie navale en Europe de l'ouest et du nord,1979,2608-4228
5414,"Georges Blondel, Tempête sur l’Europe, Paris, Plon, 1937",0,
5415,Les dérapages europhobes dans le débat britannique sur la construction d’une Europe politique,2006,
5416,"Cahiers Charles V, n°41,2006. La Grande-Bretagne et l'Europe. Ambivalence et pragmatisme.",2006,
5417,L'endogamie familiale dans l'Europe catholique au XVIIIe siècle. Première approche,1977,
5418,Les moyennes montagnes d'Europe occidentale : affaiblissement ou réadaptation des campagnes ?,1997,1760-8546
5419,"Nonn (Henri), 2001 L'aménagement du territoire en Europe occidentale",2001,1760-8546
5420,"Géographes associés n°8,1990. De la France des départements à l'Europe des régions. Géoforum Nantes 89 .",1990,
5421,Klein (J.) et Castel. (Y.). — Guide statistique de l'Europe des Neuf.,1977,1760-8546
5422,S. C. Constant. J. Ritter et J. Laigroz. L'Europe du charbon et de l'acier,1969,1760-8546
5423,"Les jeunes adultes en Europe : indépendance résidentielle, activité, ressources",2001,2490-7944
5424,"Études Normandes, 44e année, n°1, 1995. Les Normands, Peuple d'Europe.",1995,
5425,"""Nouvelles"" migrations chinoises, économies plurielles et ""individuation globalisée"" en Europe",2006,
5426,"M. Delmas-Marty (dir), Procédures pénales d'Europe",1996,1953-8111
5427,La paralysie japonaise : causes et conséquences pour l'économie mondiale - un rôle pour l'Europe,1998,1958-8992
5428,Risques et périls pour les oiseaux d'Europe hivernant en Afrique Tropicale,1990,1961-8603
5429,C. Moindrot. La Grande Bretagne en Europe. « Le Monde en mouvement»,1973,2108-6478
5430,Les fortifications en terre en Europe occidentale du Xe au XIIe siècle,1981,2275-5039
5431,Le symposium de Matrahaza (Hongrie) « Les Lumières en Europe centrale et orientale »,1974,1952-403
5432,"Pascal M. Kitromilidis, La Révolution française et l'Europe du Sud-Est",2002,1952-403
5433,Les lois de «lustration» en Europe Centrale et Orientale : une «mission impossible» ?,2000,
5434,"Récupération et basket-ball : la préparation terminale du championnat d'Europe cadets, 1997",2000,
5435,"Pascal Dethurens, De l’Europe en littérature (1918-1939), Genève, Droz, 2002",0,2273-0311
5436,II. L'accueil de Luther dans l'Europe du XVIe siècle : quelques éclairages,1983,
5437,René et Georges Cattaui. — Mohamed-Aly et l'Europe.,1951,2076-8435
5438,La variabilité du climat dans l'Europe du Nord-Ouest : le cas des Iles Britanniques,1988,2547-5614
5439,"Allocution de Andreï Teodorescu, Vice-Président de l'IASI/ Europe, Roumanie",2008,
5440,L’enseignement du sanscrit et de la grammaire comparée dans les universités d’Europe et d’Amérique,1888,
5441,Midgley M. S. (2008) – The Megaliths of Northern Europe.,2009,1760-7361
5442,Dans quelle mesure l’Europe est-elle chrétienne ? Valeurs chrétiennes et identité européenne,2003,
5443,Quelques remarques sur les noms de famille des Juifs en Europe Orientale,1950,
5444,Une élite insulaire au service de l'Europe : les jacobites au XVIIe siècle,1973,1953-8146
5445,Abel-Rémusat et Hegel : sinologie et philosophie dans l’Europe du XIXe siècle,2014,1969-6663
5446,Dafydd ap Gwilym and the debt to Europe,1998,
5447,"Conclusion provisoire. Face aux conflits yougoslaves : citoyenneté, démocratie, Europe",1992,2111-4412
5448,"Yann Rivière, Le cachot et les fers. Détention et coercition à Rome",2005,1955-270
5449,Problèmes d'organisation administrative des capitales d'Europe centrale orientale (Problems of administrative organization of central eastern european capitals),1998,2275-5195
5450,"Risques naturels et aménagements en Europe : répartition des compétences, niveaux territoriaux de gestion des risques et acteurs (Natural risks and development control in Europe : institutional structures, steps for risks management and actors)",2004,2275-5195
5451,De la dé-paysannisation à la dé-ruralisation ? (From de-peasantification to de-ruralisation ? ),2005,2275-5195
5452,Le réseau européen des Lignes à Grande Vitesse : espoir ou impasse ? (The European network of high-speed rail lines : hope or deadlock ?),2008,2275-5195
5453,Le voyage du rās Tafari en Europe (1924) : entre espoirs d’indépendance et réalités coloniales,2013,2077-0820
5454,"La musique dans le processus identitaire en Europe centrale : Hongrie et pays tchèques // Music in the identity process in central Europe, the case of Hungary and the Czech countries",2004,1777-5884
5455,La paléogéographie de l'Europe centre-occidentale au Weichsélien. Réflexions sur les paléosols et l'inertie climatique : la place du Massif Central,1991,1965-0795
5456,"Première récolte en France de la galle d'Agathomyia wankowiczii (Schnabl, 1884) (Diptera, Platypezidae, Callomyiinae) sur le Ganoderma applanatum (Pers.) Pat., 1889 (Basidiomycota, Aphyllophoromycetideae, Poriaceae)",2005,2613-2958
5457,Un lignage aristocratique d’envergure internationale dans l’Europe du XIXe siècle. La Maison d’Arenberg,2010,2295-9068
5458,"Les régions de la Communauté européenne : convergence, divergence ou recomposition des disparités",1993,2547-5614
5459,Feu et industrie osseuse. Un marqueur d'identité culturelle,2000,1957-701
5460,Contribution au débat sur l'aménagement du territoire en France,1994,1776-2936
5461,"Européanisme, nationalisme, libéralisme dans les éditoriaux de Louis Pauwels (Figaro-Magazine, 1977-1984)",1986,1960-6001
5462,"Merlin, Suibhne et Lailoken. A propos d'un livre récent",2002,2295-9068
5463,1989-1994: Le difficile réveil de l'opposition,1994,1996-4609
5464,Séance du vendredi 21 mai 1943,1943,2297-5810
5465,Les organisations internationales et la crise yougoslave,1992,1958-8992
5466,Les métamorphoses autour du concept clé d'émancipation,1999,2101-0226
5467,Complot maçonnique et complot jésuitique,1965,1952-403
5468,"Les secrets de la Maison-Blanche : l’impact des fuites d’informations confidentielles sur la politique étrangère des États-Unis, de Karine Prémont, Québec, Presses de l’Université du Québec, 2012, 311 p.",2014,1703-8480
5469,Prédicats nominaux et compatibilité aspectuelle,1996,1958-9549
5470,Notes pour Henri Michaux,1992,2111-4412
5471,"Tanger, son statut, sa zone (1923-1956)",1996,2613-2702
5472,La démarche européenne de la Turquie et la construction européenne,1989,1958-8992
5473,Baldwin ou les spores perdues de l'Amérique : Conscience de l'origine et origine de la conscience,2001,
5474,« Homines pestilentes »,1998,2102-5924
5475,L'Affaire L'Hoste ou la tentation espagnole (1604),1995,1776-3045
5476,"Sexe, société et création : Consuelo et La Comtesse de Rudolstadt",1976,1957-7958
5477,Utilisation de l'ADN ancien en anthropologie,1994,1777-5469
5478,Le montage d'une grammaire seconde,1975,1958-9549
5479,Mémoire et création dans les Letters from an American Farmer de St. John de Crèvecoeur,1983,2117-590
5480,Sur les plis cérébraux des lémuriens en général et du Loris grêle en particulier,1895,1777-5469
5481,"Les gardiens du bon usage : Étude critique de « Philosophical Foundations of Neuroscience  », de P. M. R. Hacker et M. R. Bennett",2007,1492-1391
5482,"Hellénisme et hippocratisme dans l'Europe méditerranéenne : autour de D. Coray. Actes du Colloque du Centre d'Histoire moderne et contemporaine de l'Europe méditerranéenne et de ses périphéries, 20-21 mars 1998, Montpellier, 2000",2001,2496-7068
5483,"Gabrielle Varro and Sally Boyd eds., Americans in Europe A Sociolinguistic Perspective: Probes in Northern and Western Europe",2000,1776-3061
5484,Gabrielle Varro et Sally Boyd (éd.). Americans in Europe. A socio-linguistic Perpective : Probes in Northern and Western Europe,1999,1777-5418
5485,"Dumoulin (Michel), éd. Plans des temps de guerre pour l'Europe d'après-guerre, 1940-1947. Wartime Plans for Postwar Europe, 1940-1947. Actes du Colloque de Bruxelles",1998,2295-9068
5486,"Henderson (W. O.). Britain and industrial Europe, 1750-1870. Studies in British influence on the industrial revolution in Western Europe.",1955,2295-9068
5487,Kautsky (Karl) Communism in Central Europe in the Time of the Reformation (Le Communisme en Europe Centrale à l'Epoque de la Réforme),1960,1777-5825
5488,"Le vin en Europe à travers le temps : Image et réalité du vin en Europe. Colloque pluridisciplinaire Vin et Sciences, Louvain-la-Neuve, 28 septembre-ler octobre 1988",1991,1775-3864
5489,"Jean-Claude Barbier, The road to social Europe. A contemporary approach to political cultures and diversity in Europe",2013,2490-7944
5490,"Jean-Pierre Bois : L'Europe à l'époque moderne. Origines, utopies et réalités de l'idée d'Europe, 16e-18e siècles, 1999. (Coll. «U. Histoire».)",2000,1760-7892
5491,"Marc, Alexandre, Contre les États : Les régions d’Europe (Collection Régions) Préface de A. Marc, introduction de G. Héraud, Presses d’Europe, Nice, 1973, 233 p.",1975,1703-7891
5492,"Actes du cinquième colloque de Mátrafüred, 24 octobre 1981, Les Lumières en Hongrie, en Europe centrale et en Europe orientale, Budapest, Akadémiai Kiadó ; Paris, CNRS, 1984",1986,2102-5452
5493,"Le Tardiglaciaire en Europe du Nord-Ouest : Studies in the Lateglacial of Nort West Europe, ed. J.J. Lowe, J.M. Gray, J.E. Robinson",1983,1777-5884
5494,"Les tempêtes, un concept et une genèse revisités : I'exemple de la façade occidentale de l'Europe / Storms, a notion revisitated : the case of Western Europe facade",2003,1777-5884
5495,"Andrew Linn, Investigating English in Europe : contexts and agendas, English in Europe vol. 6, Boston, Berlin, De Gruyter Mouton, 2016",0,1638-1580
5496,Recherche sur les types de peuplement dans l'Etat de Saint- Paul (Brésil),1935,2275-5195
5497,"Jacques Gauthier, 1996. Les Écoles populaires kanak. Une révolution pédagogique ?",2000,1760-7256
5498,50 ans après Bretton Woods : quel est l'avenir du système monétaire international ?,1994,1777-5744
5499,Les Cahiers de Kérylos,2003,
5500,"Pologne : les nouveaux défis de ""Solidarité""",1989,1958-8992
5501,Observations sur le texte des historiens byzantins (partie 1),1865,1969-6663
5502,"Marie-Charles-Isidore de Mercy, évêque de Luçon en Vendée. Lettres d'émigration, 1790-1802, éditées par l'abbé Louis Delhommeau. Introduction de François Garnier, évêque de Luçon. Préface de Thierry Heckmann. La Roche-sur-Yon : Siloë, 1993. In-8°, XLV-875 pages, ill., couv. ill.",1995,1953-8138
5503,Regard à l'est: Essais esthétiques et politiques de Jan Patočka,1992,1783-1768
5504,"Bernier, Gérald et Boismenu, Gérard (sous la direction de). Crise économique, transformations politiques et changements idéologiques. Actes du colloque de la Société québécoise de science politique, 1983. Montréal, Association canadienne-française pour l’avancement des sicences, Coll. « Cahiers de l’ACFAS », no. 16, 1983, 523 p.",1984,1703-7891
5505,"Pierre Chaunu, La Mort à Paris, XVIe, XVIIe, XVIIIe siècles",1979,1776-3045
5506,L’accompagnateur solitaire,2012,2613-2699
5507,"La réduction de la dette des pays en voie de développement : Méthodes, effets et difficultés",1990,1777-5744
5508,"Politique monétaire, choix de portefeuille du secteur bancaire et canal de la prise de risque",2012,1710-3991
5509,Économie Publique Appliquée,2000,1777-5795
5510,Les trahisons de l'hyperbole,1988,1710-0305
5511,Les incidences de la politique de sécurité intérieure sur les libertés individuelles : l'exemple de la politique d'immigration de la France,1997,2119-4831
5512,Les investissements étrangers directs : développement et spécificité des échanges avec la communauté européenne,1993,1777-5574
5513,Orphée dans le miroir du conte merveilleux,1985,1953-8103
5514,Économie et transitions,1994,2259-6100
5515,Recherches récentes sur les causes des conflits dans la société yougoslave,1972,2259-6100
5516,Échos,1996,2391-1387
5517,Livres d'images,1949,1777-5329
5518,Le malheur des Serbes,1999,1958-8992
5519,Les migrations forcées,2005,
5520,L'échec de la stabilisation monétaire en Russie : 1991-1998,1999,2259-6100
5521,Mouvements internationaux de capitaux à court terme,1973,1777-5795
5522,"Les oeuvres d’un humaniste : Pierre Gilles d’Albi, amoureux du savoir (1490-1556)",2008,2496-7068
5523,Une lecture démographique de la frontière Est-Ouest,1995,2259-6100
5524,Vatican II entre catholicisme et catholicité : D’une théologie de la délimitation à une théologie de la récapitulation,2012,1703-8804
5525,Le corps exilé dans le Décaméron : corpus alienum,2013,2429-9499
5526,Le souci de soi dans «Être et Temps». L'accentuation radicale d'une tradition antique?,2002,1783-1768
5527,Gautier et Margarit : deux épisodes de la Chanson de Roland,1960,2119-1026
5528,Les réalités d'un ailleurs : Chateaubriand et le Voyage en Amérique,1976,1958-5926
5529,Ethiopie,1986,1952-4226
5530,Principes et problèmes du gouvernement asymétrique,1998,1703-8480
5531,« La Suisse terre d'asile » : un mythe ébranlé par l'histoire,1997,1777-5418
5532,"Marcel Reinhard, La chute de la royauté, 1969",0,1952-403
5533,Le « Triangle de Weimar » et la « double ouverture » euro-atlantique de la Pologne,2009,1703-7891
5534,"Exodo, d'une légende à l'autre, le chapitre IV de Hijo de hombre",1993,2427-9048
5535,Militantisme et messianisme ouvriers au Chili à travers la presse de la Pampa nitrière (1900-1930),1986,2272-9828
5536,Orthographe de la Renaissance : Perspectives d'ensemble,1997,1783-1601
5537,Bibliographie,1998,1492-1383
5538,La Californie et les médias,1985,1920-7344
5539,"11. Jaschinski (S.), Alexander und Griechenland unter dem Eindruck der Flucht des Harpalos",1987,2260-8079
5540,Quelques pratiques malgaches relatives aux accouchements,1930,1777-5469
5541,Suite de la séance du 2 février 1893,1893,1777-5469
5542,Les humanités sabotées,1926,2275-5160
5543,Au sujet de l'Andorre,1919,1775-3821
5544,Note sur l'introduction de mots anglais dans le vocabulaire de la psychologie,1955,1969-6981
5545,"K.-S. Karol, La Chine de Mao, Paris, Robert Laffont, 1966",1967,2101-0226
5546,Psychophysiologie,1978,1955-2580
5547,Boutruche (Robert). La crise d' une société. Seigneurs et paysans du Bordelais pendant la Guerre de Cent Ans,1950,2295-9068
5548,La propagande antialcoolique en milieu scolaire au début du XXe siècle,1996,1775-3864
5549,Sentiments des anciens sur le machinisme,1938,2540-2544
5550,"Tom Verschaffel. De hoed en de hond. Geschiedschrijving in de Zuidelijke Nederlanden, 1715-1794",2000,2295-9068
5551,Résumés des articles,1972,1950-6694
5552,"Albert Bayet et François Albert. Les écrivains politiques du XVIIIe siècle. Extraits avec une introduction et des notes, 1904",1905,1776-3045
5553,Ouvrages et documents reçus : bibliographie,1969,1963-1359
5554,Concepteur - rédacteur est-ce un métier qui s'apprend ?,1966,1778-7459
5555,Qu'est-ce qu'un ordinateur ?,1968,1778-7459
5556,Lettre ouverte d'un élève de classe de troisième,1985,1778-7459
5557,"College Graduates and Jobs, Adjusting to a New Labor Market Situation, by The Carnegie Commission on Higher Education, New York, McGraw-Hill, 1973, 242 pp.",1973,1703-8138
5558,"Choucri, Nazli. Energy and Development in Latin America : Perspectives for Public Policy, Lexington (Mass.), Lexington Books, 1982, 240 p.",1983,1703-7891
5559,"Bram DIJKSTRA : Idols of Perversity. Fantasies of Feminine Evil in Fin-de-siècle Culture, Oxford University Press, New York, 1986, 453 p., biblio., index, ill.",1987,1703-7921
5560,"Discours de M. Je Dr Royet, président pour 1904",1904,2613-2958
5561,Lignes de forces d'une encyclique,1968,1963-1359
5562,Allocution du nouveau Président,1917,1969-6663
5563,Charles Michel,1930,2275-5160
5564,Lahire (Bernard). — Tableaux de familles : heurs et malheurs scolaires en milieux populaires,1997,2105-2913
5565,Sur les groupements des grandes cellules pyramidales dans la région motrice des membres,1888,1777-5469
5566,Au risque des arts contemporains,2010,
5567,Les Grillons de la faune française. Réplique à G. Cousin à propos des Grillons de la région parisienne,1947,
5568,Le Symposium sur l'enseignement de la géographie,1966,1777-5884
5569,Questions et discussions,1921,
5570,Notes pédagogiques,1925,
5571,La réforme de l’enseignement du dessin,1916,
5572,La fête des écoles en 1907,1907,
5573,Liste des ouvrages offerts au Musée pédagogique (suite).,1896,
5574,Problèmes biographiques,1987,2117-718
5575,L'entreprise russe et le commerce extérieur,1993,2259-6100
5576,Ideals of Immersion in Early Cinema,2003,1705-6500
5577,La jouissance du voir dans Je tu il elle de Chantal Akerman,1998,1705-6500
5578,"Le militaire, le politique et les successions en URSS",1985,1703-7891
5579,Diuerbia et cantica dans la Phèdre de Sénèque: un tissage complexe,2009,1783-1830
5580,La mémoire d'un captif,1986,1953-8146
5581,"Peter Scholliers, Wages, Manufacturers and Workers in the Nineteenth-Century Factory. The Voortman Cotton Mill in Ghent",1998,1953-8146
5582,"Études sur l'histoire, les lois et les institutions de l'époque mérovingienne, tome Ier, par Jules de Pétigny.",1843,1953-8138
5583,Les noms du lièvre et du lapin,1955,2295-9068
5584,Informations,2008,
5585,"Jean-Eudes Girot, Marc-Antoine Muret. Des Isles Fortunées au rivage romain, coll. «Travaux d’Humanisme et Renaissance » , n° DII, 2012",2014,1969-654
5586,"The Geographical Journal, London, June-November 1897",1898,2297-5810
5587,"Gachon (Lucien), Une haute colline du Livradois : son passé humain d'après son cadastre",1936,1960-601
5588,Les enjeux d'une production autonome,1996,1963-1359
5589,Les protestants français pendant la seconde guerre mondiale,1993,1950-6678
5590,"Al Alletzhauser. Nomura, légende et histoire secrète d'une dynastie japonaise",1992,1958-8992
5591,"Kornbluh, Peter. Nicaragua : The Price of Intervention. Reagan’s War against the Sandinistas, Washington (D.C.), Institute for Policy Studies, 1987, 303 p.",1989,1703-7891
5592,"Andrzej Wyczanski, Polska Rzecza Pospolita szlachecka (La république nobiliaire polonaise)",1994,1776-3045
5593,"Fernand L'Huillier, Les Recherches sur l'Alsace napoléonienne",1949,1953-8146
5594,Remarques sur le personnage d'Attila dans les légendes germaniques,1948,1969-6663
5595,Le culte des morts au XXe siècle,1902,1777-5469
5596,À propos des « 7 thèses erronées sur l'Amérique latine »,1973,2101-0226
5597,Industries d'armements et territoires : la crise du « modèle de croissance militarisée » aux U.S.A.,1994,1777-5884
5598,Dollarisation et hétérodoxie en Amérique latine,1987,1963-1359
5599,Les dix années de captivité du missionnaire Ohrwalder au Soudan,1894,2297-5810
5600,La guerre de 1914-1918. Essais d'histoire culturelle,1994,1950-6678
5601,Le miracle de la moisson en Galles,1948,1969-6663
5602,Repères chronologiques des incidents et accidents survenus dans les centrales et centres d'expérimentation nucléaires,1986,1958-8992
5603,"Interprétation de la Convention de Londres du 12 mai 1954 et de la loi du 26 décembre 1964, modifiée. / Rejet involontaire d'hydrocarbures â la suite d'une avarie. Défaut de précautions raisonnables. Applicabilité des dispositions pénales de la loi de 1964. / Détermination du responsable, en cas de remorquage ou d'assistance au navire à partir duquel a lieu le déversement. Cour d'Appel de Rennes (Chambre d'accusation) 15 octobre 1979. Avec commentaire",1980,
5604,La légende des Danaïdes,1949,2105-2573
5605,Zoologie antique et lampes romaines,1925,2540-2544
5606,De quelques singularités proustiennes,1987,2273-0311
5607,Le secteur européen de la gestion des pensions,2002,1777-5744
5608,Ambiguïtés des modèles et spécificité de la société martiniquaise,1971,1958-5691
5609,"Quand écrire, c’est blesser (les lecteurs) : témoignages des camps et communauté négative",2010,1708-9069
5610,"Négritude, créolité, métissage. Phénoménologie de la pensée ultramarine",1999,
5611,Le problème de l’éducation morale dans un roman de Meredith,1911,
5612,"J'accuse, un film conforme aux aspirations de Charles Pathé et à l 'air du temps",1996,1960-6176
5613,Notes de travail sur Le Printemps d'Agrippa d'Aubigné : une lecture thématique,1993,2417-6516
5614,Livres reçus au premier semestre 1997,1997,1958-5691
5615,"André Vauchez. La sainteté en Occident aux derniers siècles du Moyen Age d'après les procès de canonisation et les documents hagiographiques. Rome, Ecole française de Rome, 1981. In-8°, X-765 pages, tableaux, cartes et figures. [Bibliothèque des Ecoles françaises d'Athènes et de Rome, 241.]",1982,1953-8138
5616,La fonction symbolique du cortège dans les rituels populaires du mariage,1978,1953-8146
5617,Le suicide des personnes âgées comparaisons nationales et internationales (1976-1987),1990,2104-3752
5618,L'Amérique latine et la crise de la dette,1990,1777-5744
5619,Un problème des transports aériens : la sécurité,1938,1777-5884
5620,"Voyager au moyen âge. VIIe Congrès de la Fondation-Centre d'Études sur la Civilisation du moyen âge tardif. San Miniato (Pise), 15-18 octobre 1998",1999,2119-1026
5621,"La communication, comme la langue d'Esope",1980,1778-7459
5622,République populaire de Chine-Union européenne : vers un partenariat stratégique en matière migratoire ?,2005,2262-3353
5623,De l'intégration financière à l'unification monétaire européenne,1987,1777-5744
5624,Regard sur l'environnement à Malte : enjeux et perspectives,2004,2547-5614
5625,La protohistoire bolonaise,1913,1775-383
5626,Où va l'Allemagne ?,1990,
5627,Afrique : conflits et développement,2003,1958-8992
5628,La lutte contre l’exclusion sociale par une approche fondée sur l’accès aux droits sociaux,2003,1775-3945
5629,"La diversification dans l’Union européenne, un véritable défi pour l’intégration",2018,
5630,Chronopost ou l’alliance géographique du temps et de l’espace,1993,2431-210
5631,Autour du manuscrit hébreu G 231 (2) des Archives départementales de l'Aude : Juifs et non Juifs à Carcassonne à l'époque médiévale,1989,2496-7068
5632,Quelques précisions sur le « départ » de Léon Tolstoï,1961,2117-718
5633,Les représentations de la nature : l'exemple des zoos,1999,
5634,Penser le sens d’une humanité européenne à rebours du paganisme national et des incantations humanitaires,2006,1703-8804
5635,Reprise démographique et nouvelles populations dans les moyennes montagnes françaises,2001,2104-3752
5636,Une approche intégrée du vieillissement dans deux villes sidérurgiques : Denain (Nord - Pas-de-Calais) et Seraing (Province de Liège),2001,2104-3752
5637,L'exil américain de Saint-John-Perse,1991,2076-8443
5638,L'immigration africaine en Italie : le cas sénégalais,1993,1703-7891
5639,Autour de deux pièces de Tolstoj,1965,2117-718
5640,"Vingtième Siècle, revue d'histoire, n°41, janvier-mars 1994. La guerre de 1914-1918. Essais d'histoire culturelle.",1994,1950-6678
5641,Les puissances moyennes et la crise internationale,1981,1958-8992
5642,Droits de l'homme et migration : l'émergence d'un enjeu international. Entretien avec Mariette Grange,2008,2262-3353
5643,Town and Country : Juxtaposing Ireland's Big House and Europe's Capitals in Bowen's The House in Paris and The Heat of the Day,2005,2259-8863
5644,Le logement et la différenciation sociale et résidentielle dans la ville pré-industrielle en Europe occidentale (XVIe-XVIIIe siècles),1986,2104-3752
