num_doc,title,annee_publication,issn
2912,"Hydrocarbures, environnement et télédétection dans le domaine polaire russe / Hydrocarbon industries, environment and remote sensing in the polar regions of Russia",1999,1960-601
2913,Antiquités de la Gaule romaine,2005,
2914,Les actes du Comité des ministres du Conseil de l'Europe,1960,2105-2948
2915,L'admission des Etats comme membres du Conseil de l'Europe,1963,2105-2948
2916,La frontière franco-espagnole et l’Europe : le dépassement des limites ?,2007,2496-7068
2917,Les relations entre générations en Europe autrefois,1991,1776-2774
2918,La mortalité des enfants en Europe francophone : état de la question,1994,1776-2774
2919,Contribution à une histoire comparée des villes de l'industrie en Europe,2000,1776-2774
2920,Raul Hilberg La destruction Europe,1988,1953-8146
2921,Réflexions à propos de l'apparition du grès en Europe occidentale,1987,
2922,II. La périurbanisation en Europe (Periurbanization in Europa),2001,2275-5195
2923,L’évolution méthodologique de la diplomatique médiévale en Europe centrale,2002,1953-8138
2924,Echanges internationaux d'énergie électrique en Europe occidentale,1954,2275-5195
2925,Global ou local ? Identités nouvelles dans l’Europe unifiée,2000,1968-3758
2926,Europe : une initiative en faveur de la société de l’information pour tous,2000,1968-3758
2927,Europe : un Livre blanc sur les politiques de jeunesse,2000,1968-3758
2928,Concours : Alors comment rêvez-vous l’Europe dans 30 ans ?,2003,1968-3758
2929,Prix du conseil de l’Europe «jeunes citoyens actifs»,2003,1968-3758
2930,"De la France à l'Europe. Histoires, psychologies et physiologies nationales",1932,1953-8146
2931,"Emmanuel Berl, Histoire de l'Europe",1947,1953-8146
2932,Les transports urbains en Europe et aux Etats-Unis. 1850-1914,1984,2497-7098
2933,La télévision numérique et l'évolution de la production audiovisuelle en Europe,2000,1777-5809
2934,Gestion régionale et classe sociale : le cas de l'Europe de l'Est,1976,1958-5691
2935,L'intégration monétaire et financière internationale : un défi pour l'Europe,1987,1760-7388
2936,"Des princes, des docteurs et des vicissitudes économiques en Europe et aux Amériques",1988,1760-7388
2937,Europe-Japon : Epargner pour faire jeu égal,1992,1760-7388
2938,La faisabilité socio-économique des ajustements budgétaires en Europe,2000,1760-7388
2939,L'apport de modèles quantitatifs à la supervision bancaire en Europe,2004,1760-7388
2940,Les effets redistributifs des systèmes de retraite en Europe,2007,1760-7388
2941,Pierre- Yves Pétillon. — L'Europe aux anciens parapets,1987,1776-3061
2942,Marchal (André) - L'Europe solidaire,1965,1950-6686
2943,Pratiques religieuses dans l'Europe révolutionnaire. Le colloque de Chantilly,1990,2109-9502
2944,Gerbet (Pierre) - La construction de l'Europe.,1984,1950-6686
2945,Associations d'Études Américaines en Europe (et leurs publications),1983,1776-3061
2946,Les transformations du travail et de l'emploi en Europe de l'Est depuis 1990,1998,2259-6100
2947,Décommunisation et justice politique en Europe centrale et orientale,1998,2259-6100
2948,L'Allemagne et l'est européen. Le défi d'une configuration intégrative de l'Europe,2001,2259-6100
2949,Les transformations religieuses en Europe centrale et orientale,2004,2259-6100
2950,L'Église catholique romaine en Europe de l'Est : perceptions polonaises,2004,2259-6100
2951,Avant propos : l'immigration en débat (France/Europe),1998,2105-2956
2952,"Quaderni, n°36, Automne 1998. L'immigration en débat (France/Europe)",1998,2105-2956
2953,« Les hésitations offensives de l'Europe : le cas de l'électronique »,1984,1773-0198
2954,Insertion sociale des réfugiés et demandeurs d'asile en Europe,1987,1777-5418
2955,Le développement des activités indépendantes des immigrés en Europe et en France,1992,1777-5418
2956,Citoyenneté et racisme en Europe : exception et complémentarité britanniques,1994,1777-5418
2957,Groupes d'intérêts et consolidation démocratique en Europe méridionale,1995,1960-6656
2958,Religion et politique dans l'Europe du Sud : Permanence et changement,2002,1960-6656
2959,"La Grande-Bretagne, l'Europe et l'Entente franco-anglaise",1936,1958-8992
2960,Le fédéralisme suisse à l'épreuve du temps : un modèle pour l'Europe ?,1991,2119-4831
2961,La méthode de transformation des économies d'Europe centrale et orientale,2002,2119-4831
2962,Lopez (Robert). Naissance de l'Europe,1964,2295-9068
2963,La fin de l'Europe napoléonienne. A propos d'un livre récent,1992,2295-9068
2964,Galasso (Giuseppe). L'Autre Europe,1995,2295-9068
2965,La compétition plurimodale et la transformation des relations en Europe centrale,1983,2108-6478
2966,André Blanc. L'Europe socialiste.,1985,2108-6478
2967,Les vieilles villes industrielles d'Europe occidentale,1985,2108-6478
2968,"Revue Géographique de l'Est. Tome 29, N°2, année 1989. Régions d'Europe.",1989,2108-6478
2969,"Revue Géographique de l'Est, tome 34, n°3-4,1994. Voies navigables en Europe.",1994,2108-6478
2970,Blanchard (Raoul). — Géographie de l'Europe.,1937,1760-7426
2971,Juillard (Etienne). — L'Europe rhénane.,1970,2108-6478
2972,Europe et enseignement : quelques questions autour des valeurs,1999,1968-3936
2973,Planification et croissance économique en Union Soviétique et l'Europe de l'Est,1971,2259-6100
2974,Remarques sur la coopération économique entre l'Europe de l'Est et de l'Ouest,1974,2259-6100
2975,Les aspects politiques des réformes économiques en Europe de l'Est,1975,2259-6100
2976,La pénétration des sociétés multinationales dans les pays d'Europe de l'Est,1976,2259-6100
2977,Chronique des activités du conseil de l'Europe dans le domaine de l'environnement 1997-1998,1999,2513-6097
2978,Marchal (André) - L'Europe solidaire.,1965,1950-6694
2979,Hetman (François) - L' Europe de l'abondance.,1969,1950-6694
2980,Les émeutes de subsistances en Chine et en Europe occidentale,1983,1953-8146
2981,"Christian Ambrosi, L'apogée de l'Europe, 1871-1918, 1969",1969,2271-7005
2982,"Siegfried J. De Laet, La préhistoire de l'Europe, 1967",1969,2271-7005
2983,Louis Châtellier. L'Europe des dévots,1988,2105-2573
2984,Les ordres mendiants en Europe du Centre-Est et du Nord,1990,
2985,Construction et déconstruction de la famille en Europe : une analyse comparative,1994,2490-7944
2986,L'évolution récente de la stature en Europe occidentale (Période 1960-1980),1983,1777-5469
2987,Note sur la longueur du pénis des habitants de l'Europe centrale,1948,1777-5469
2988,Le jeu poétique dans l'Europé de Moschos,2001,2275-5160
2989,Les débuts de l'immigration des Tziganes dans l'Europe occidentale,1889,1777-5469
2990,"Louis Châtellier : L'Europe des dévots, 1987",1988,1760-7892
2991,"Leonid Belozubov, l'Europe savante (1718-20), 1968",1970,1760-7892
2992,Nouvelles recherches sur l'apparition et la dispersion des Bohémiens en Europe.,1850,1953-8138
2993,Pratique dominicale urbaine et âges en Europe occidentale,1964,1777-5825
2994,"Girard (Louis) Le Catholicisme en Europe, de 1814 à 1878",1964,1777-5825
2995,"Archives de sciences sociales des religions, n°92, 1995. L'islam en europe.",1995,1777-5825
2996,Prudence et Courage. La situation religieuse en Russie et en Europe de l'Est,1976,1777-5825
2997,L'Europe unie dans l'enseignement des Papes,1983,1777-5825
2998,Chatellier (Louis) L'Europe des dévots,1987,1777-5825
2999,La Philosophie d'inspiration chrétienne en Europe,1991,1777-5825
3000,Les systèmes familiaux en Europe : de l'intérêt des modèles,1997,1953-8103
3001,L'Europe de l'Est vue de Moscou ou « Mais comment peut-on être hongrois ? »,1988,2101-0226
3002,"J. Kotek, L'Europe et ses villes-frontières",1997,1777-5876
3003,Les Rhubarbes cultivées en Europe et leurs origines.,1942,2437-2226
3004,L'état et le développement du réseau de télécommunications en Europe à ses débuts,1989,1777-5906
3005,"La France et les bouleversements en Europe, 1989-1991, ou le poids de l'idéologie",1994,1777-5906
3006,Un technicien britannique en Europe méridionale : Philip Taylor (1786-1870),2000,1777-5906
3007,"Jack Goody, La famille en Europe",2003,1777-5906
3008,Essai sur les limites des provinces de la Turquie d'Europe,1862,2297-5810
3009,L'industrialisation spontanée face à la crise de 1973 en Europe occidentale,1984,1960-601
3010,Les traversées à vapeur d'Europe aux États-Unis,1901,1777-5884
3011,Dix mille kilomètres à pied à travers l'Europe,1893,2297-5810
3012,Raoul Blanchard. — Géographie de l'Europe,1937,1960-601
3013,La qualité de l'emploi en Europe : une approche comparative et dynamique,2007,1777-5574
3014,Saint-Marin la plus petite République de l'Europe,1930,2297-5810
3015,Jean Labasse : L'Europe des régions,1992,2104-3752
3016,Alfred Sauvy : L'Europe et sa population,1954,1777-5876
3017,Les genres de vie tardenoisiens en Europe Occidentale,1955,1777-5876
3018,Les minorités nationales en Europe à l'époque contemporaine,1996,
3019,Nationalités et minorités nationales en Europe à l'époque contemporaine,1997,
3020,Nationalités et minorités nationales en Europe à l'époque contemporaine,1998,
3021,Nationalités et minorités nationales en Europe à l'époque contemporaine,1999,
3022,Nationalités et minorités nationales en Europe à l'époque contemporaine,2000,
3023,Nationalités et minorités nationales en Europe à l'époque contemporaine,2001,
3024,Nationalités et minorités nationales en Europe à l'époque contemporaine,2002,
3025,Histoire politique de l'Europe du XVIe au XVIIIe siècle,2003,
3026,Nationalités et minorités nationales en Europe à l'époque contemporaine,2003,
3027,Histoire politique de l'Europe du XVIe au XVIIIe siècle,2004,
3028,Histoire politique de l'Europe du XVIe au XVIIIe siècle,2005,
3029,Histoire politique de l'Europe du XVIe au XVIIIe siècle,2006,
3030,Histoire politique de l'Europe du XVIe au XVIIIe siècle,2007,
3031,L'Europe et le monde germanique [époque moderne et contemporaine],2007,
3032,XV. — Histoire des idées religieuses dans l'Europe moderne,1931,
3033,XV. — Histoire des idées religieuses dans l'Europe moderne,1932,
3034,XV. — Histoire des idées religieuses dans l'Europe moderne,1933,
3035,XIII. — Histoire des idées religieuses dans l'Europe moderne,1934,
3036,XIII. — Histoire des idées religieuses dans l'Europe moderne,1935,
3037,XIV. — Histoire des idées religieuses dans l'Europe moderne,1937,
3038,XIV. — Histoire des idées religieuses dans l'Europe moderne.,1937,
3039,XIV. — Histoire des idées religieuses dans l'Europe moderne,1938,
3040,XI. — Mythologie comparée et anciennes religions de l'Europe,1943,
3041,XXI. — Histoire des idées religieuses dans l'Europe moderne,1944,
3042,XXI. — Histoire des idées religieuses dans l'Europe moderne,1946,
3043,XXI. — Histoire des idées religieuses dans l'Europe moderne,1947,
3044,XXII. — Histoire des idées religieuses dans l'Europe moderne,1948,
3045,XXII. — Histoire des idées religieuses dans l'Europe moderne,1949,
3046,XXII. — Histoire des idées religieuses dans l'Europe moderne,1950,
3047,XXII. — Histoire des idées religieuses dans l'Europe moderne,1951,
3048,XXIII. — Histoire des idées religieuses dans l'Europe moderne,1953,
3049,XXIII. — Histoire des idées religieuses dans l'Europe moderne,1954,
3050,XXIV. — Histoire des idées religieuses dans l'Europe moderne,1955,
3051,XXVI. — Histoire des idées religieuses dans l'Europe moderne,1956,
3052,XXVIII. — Histoire des idées religieuses dans l'Europe moderne,1957,
3053,XXVIII. — Histoire des idées religieuses dans l'Europe moderne,1958,
3054,XXVIII. — Histoire des idées religieuses dans l'Europe moderne,1959,
3055,XXVIII. — Histoire des idées religieuses dans l'Europe moderne,1960,
3056,XXIX. — Histoire des idées religieuses dans l'Europe moderne,1961,
3057,Une région sous-développée de l'Europe méditerranéenne : la Calabre,1961,1777-5884
3058,Le fer et la production du fer en Europe de 500 à 1500 (note critique),1972,1953-8146
3059,Gestion des sur-effectifs et politiques de formation de reconversion en Europe,1993,2107-0946
3060,Comparabilité et reconnaissance des qualifications en Europe : Instruments et enjeux,1993,2107-0946
3061,Formation et emploi des ingénieurs dans quatre régions d'Europe,1995,2107-0946
3062,"L'Europe et ses philosophes: Nietzsche, Husserl, Heidegger, Patocka",2006,1783-1768
3063,L'émigration de l'Europe centrale et orientale et le réarmement allemand,1952,1958-8992
3064,lre partie : Plaines de l'Europe du Nord-Ouest,1984,1965-0795
3065,Mythes d'Europe et constructions d'un paysage culturel antagonique,2008,
3066,Les Institutions d'Europe occidentale au moyen âge,1948,2295-9068
3067,Après Maastrich : quelles politiques économiques en Europe ?,1993,1777-5647
3068,Régimes de change et coordination des politiques économiques en Europe,1993,1777-5647
3069,Homogénéisation ou diversification des systèmes de valeurs en Europe occidentale,1999,1777-5647
3070,Les objets paléomonétaires de l'Europe atlantique protohistorique,2001,1963-1693
3071,Roman Glass Production in Western Europe,2000,
3072,"Étiquette mobile d'Europe du Nord : Suède, XIXe s",1983,1775-3864
3073,Pour l'interprétation des trouvailles monétaires arabes en Europe orientale,1978,2117-6809
3074,Les grandes haies forestières de l'Europe médiévale,1979,2117-6809
3075,Les travaux de droit privé du Conseil de l'Europe,1977,
3076,Religion et sécularisation en Europe occidentale. Tendances et prospectives,1983,1783-8401
3077,"L'avenir du catholicisme en Europe. Analyses, questions, convictions",2002,1783-8401
3078,Carmoy (Guy de) - Fortune de l'Europe.,1954,1950-6694
3079,Réflexions d'un industriel scandinave sur le protectionnisme et la concurrence en Europe,1960,1950-6694
3080,Les dimensions complexes d'une rencontre : Europe et islam,2005,1783-8401
3081,"L'Etat, la Nation, l'Europe : A la recherche d'une nouvelle hétérodoxie.",1996,1950-6694
3082,La politique de change dans les pays d'Europe centrale,1994,1950-6694
3083,La transition en Europe centrale : interprétation et voies alternatives,1994,1950-6694
3084,L'avenir de l'Europe industrielle dans une économie mondiale en mutation,1988,1950-6694
3085,Une stratégie de croissance ambidextre pour l'Europe : l'autonomie par la coopération,1988,1950-6694
3086,Modèles du SME : l'Europe n'est-elle qu'une zone deutsche mark ?,1988,1950-6694
3087,Pierre Rain. L'Europe de Versailles (1919-1939),1945,1958-8992
3088,L'immigration turque en Europe Occidentale: repères et tendances,1986,2613-2737
3089,Schacht (Hjalmar) - De L'Or pour l'Europe.,1953,1950-6694
3090,Paul Ozenda : La végétation de l'Europe.,1994,1760-7426
3091,Les équilibres vitaux : la dépendance alimentaire de l'Europe,2000,1950-6694
3092,L'ancrage de l'Europe centrale et orientale à l'Union européenne,1999,1950-6694
3093,Zone euro et régimes de change en Europe centrale,1999,1950-6694
3094,L'Europe et le Tiers Monde : entre la mondialisation et la régionalisation,1993,1963-1359
3095,Les relations économiques entre l'Europe et le Maghreb,1993,1963-1359
3096,Relations Europe-Maghreb. La question des investissements directs,1993,1963-1359
3097,De l'histoire de la pauvreté en Europe à la pauvreté dans le Tiers Monde,1995,1963-1359
3098,Pologne. L'insurrection de 1830- 1831. Sa réception en Europe.,1983,1957-7958
3099,"Colloque économique Iran-Europe. Téhéran, 15-17 mars 1975",1975,1963-1359
3100,Quelle Europe attendons-nous face au Tiers Monde ?,1977,1963-1359
3101,"« Le rôle de l'Europe dans le développement mondial ». Milan, 19-25 septembre 1978",1979,1963-1359
3102,Échanges ou communications culturelles dans l'Europe médiévale ? Conclusion,2001,2117-6809
3103,"Sociétés contemporaines N°2, Juin 1990. Europe de l'Est des sociétés en mutation.",1990,1950-6899
3104,Histoire littéraire de l'Europe médiane,1999,2117-718
3105,"Jean Robinet, Paysans d'Europe.",1975,1777-537
3106,"La circulation des artistes, des oeuvres, des modèles dans l'Europe médiévale",1998,1953-812
3107,Dossier : identités d'Europe centrale après le communisme,1992,1950-6678
3108,La découverte par l'Europe de la Bhagavad Gîtâ en 1785,1994,2117-590
3109,Images de l'Europe dans les manuels de géographie français,2002,2613-2737
3110,De l'Etat à l'Union Européenne : une heuristique de la «Capitale de l'Europe»,2005,2613-2737
3111,Typologie des populismes en Europe (19e-20e siècles),1997,1950-6678
3112,Facteurs socio-politiques et blocages du développement en Europe,1966,1963-1359
3113,Sur les dynamiques sociologiques et politiques de l'identification de l'Europe,2002,1950-6686
3114,Les chartes ornées dans l’Europe romane et gothique,2011,1953-8138
3115,"Politiques publiques en France L'Europe, le marché, l'État",1992,1950-6686
3116,Le conflit entre l'Europe et les États-Unis,1972,1950-6686
3117,"Les Verts, Cohn-Bendit, l'environnement et l'Europe",1999,1950-6686
3118,Les historiens et la modernité entre Europe et Uruguay.,1992,1952-4226
3119,L'insertion professionnelle des débutants en Europe : des situations contrastées,2004,1777-5574
3120,"Economie et statistique, n°403-404, 2007. Santé, vieillissement et retraite en Europe.",2007,1777-5574
3121,Vingt ans d'échanges internationaux : l'Europe sur la défensive,1989,1777-5574
3122,L'agriculture américaine est-elle plus productive que celle de l'Europe ?,1992,1777-5574
3123,Le commerce de détail en Europe : nouveaux marchés et spécialisation,1993,1777-5574
3124,La France et l'Europe dans le monde. Quelques aspects économiques,1954,1777-5574
3125,L'intensification de la production laitière : des logiques et des pratiques en Europe,1990,2105-2581
3126,Les fluctuations de la fécondité en Europe : Etats et régions.,1996,2104-3752
3127,"L'Union latine : Europe, monnaie et toile d'araignée",1989,1777-5744
3128,La gestation séculaire de l'État dépositaire dans l'Europe des Lumières,1991,1777-5744
3129,Les unions monétaires en Europe au XIXe siècle,1992,1777-5744
3130,L'avenir des institutions financières publiques en Europe de l'Ouest,1992,1777-5744
3131,L'influence de Bretton Woods sur l'intégration monétaire en Europe,1994,1777-5744
3132,"Les conglomérats financiers en Europe, stratégie et concurrence",1994,1777-5744
3133,L'intégration des pays d'Europe de l'Est dans le système monétaire international,1994,1777-5744
3134,Les externalités des systèmes de paiement : questions pour l'Europe,1995,1777-5744
3135,Le prix du médicament en Europe : Anciens et nouveaux modèles,1995,1777-5744
3136,Équité dans le financement et la prestation de soins de santé en Europe,1995,1777-5744
3137,Asymétries financières et transmission de la politique monétaire en Europe,1997,1777-5795
3138,Les trajectoires de passage à l’âge adulte en Europe,2010,2490-7944
3139,Consensus et médiation dans les séparations parentales en Europe,2014,2490-7944
3140,Pour une nouvelle analyse du développement de la police en Europe occidentale,1978,2296-4096
3141,La coopération policière en Europe et dans l'Euregio Meuse-Rhin,1992,2296-4096
3142,Les contradictions Nord-Sud au sein de l'Europe,1978,2105-2581
3143,Le bilan céréalier de l'URSS et de l'Europe orientale à l'horizon 1980,1978,2105-2581
3144,Du bon usage des politiques monétaire et budgétaire en Europe,1998,1777-5744
3145,"Le commerce électronique en Europe : risques, opportunités et tendances",1999,1777-5744
3146,La transition a été globalement un succès et l'élargissement est une opportunité pour l'Europe,2001,1777-5744
3147,La fiscalité de l'épargne en Europe : une comparaison multi-produits,2001,1777-5744
3148,"Revue d'économie financière, n°64, 2001. Epargne et investissement en Europe.",2001,1777-5744
3149,La « governance » des systèmes bancaires mutualistes et coopératifs en Europe,2002,1777-5744
3150,Europe à 25 : quel budget pour quelles politiques communes ?,2003,1777-5744
3151,Les banques postales en Europe : vers la banalisation ?,2005,1777-5744
3152,Aller plus loin dans la construction de l’Europe financière,2007,1777-5744
3153,L’Union monétaire en Europe : de Bretton Woods à nos jours,2007,1777-5744
3154,"Alep, une ville traditionnelle face à l'impact de l'Europe, 1830-1914",1987,1773-0201
3155,La Russie et l'Europe orientale dans les Archives ottomanes,1969,1777-5388
3156,Table ronde : L'Ukraine dans l'Europe post-communiste [28/05/94],1995,1777-5388
3157,"Besançon - novembre 1987 - Colloque Région, Nation, Europe",1988,1952-403
3158,Forme et imagination : l'image féminine dans l'Europe paléolithique,1993,2101-0420
3159,Macao et l'Europe : les défis du jeu de la paradiplomatie,2002,1996-4609
3160,"Les rapports de force en Asie, un défi pour l'Europe ?",2005,1996-4609
3161,L'Europe et la Méditerranée : intégration économique et libre-échange,1997,1760-8538
3162,La politique soviétique à l'égard des pays de l'Europe occidentale de 1941 à 1945,1995,1952-4226
3163,24-25. Deux journalistes français observateurs de l'Europe centrale (1907),1996,1952-4226
3164,"32. Charles Seignobos, Les aspirations autonomistes en Europe (1913)",1996,1952-4226
3165,Le rôle de la Pologne dans l'Europe du centre-est : Historique et perspectives,2001,1952-4226
3166,"Matériaux pour l'histoire de notre temps, n°5, 1986. L'Espagne vers l'Europe.",1986,1952-4226
3167,"La Grande-Bretagne, la France et la défense de l'Europe occidentale en 1950",1990,1952-4226
3168,"Publications ""informelles"" d'URSS et d'Europe centrale et orientale (1988)",1991,1952-4226
3169,"« Morphogénèse cénozoïque de l'Europe de l'Ouest » Rennes, 28-29-30 Septembre 1994",1995,1957-777
3170,"« 1936. Arts et littérature », Europe, 683, mars 1986",1986,1960-6001
3171,L'Europe des Européens chez le comte de Saint-Simon,1993,1960-6001
3172,"Europe, terme et terre d'immigration",2000,1960-6001
3173,Brève histoire des études grecques en Europe occidentale,2006,
3174,The Earth Fertility of old Europe,1987,1955-270
3175,Europe-Etats-Unis : vers un vrai découplage ?,2001,1958-8992
3176,"Quelques données de fait sur la situation des ""neutres"" en Europe",1955,1958-8992
3177,Conséquences politiques en Europe du développement des armes nucléaires,1955,1958-8992
3178,La lutte contre la pollution de l'eau en Europe occidentale,1969,2105-2948
3179,Les relations économiques entre l'Est et l'Ouest en Europe,1967,1958-8992
3180,Les changements des années 1989-1990 et l'Europe de la prochaine décennie,1991,1958-8992
3181,Nouvel environnement européen et stabilité de l'Europe centrale,1991,1958-8992
3182,Vers une nouvelle Europe : points de vue nationaux,1991,1958-8992
3183,« Nous » et « eux » : l'Europe et les Etats-Unis face à l'immigration,1994,1958-8992
3184,L'Asie et l'Europe : une nouvelle alliance pour le XXIe siècle,1994,1958-8992
3185,La politique étrangère hongroise dans le contexte de l'Europe centrale,1994,1958-8992
3186,L'avenir de Lomé : que peut l'Europe pour la croissance de l'Afrique ?,1997,1958-8992
3187,Georges Corm. L'Europe et l'Orient,1989,1958-8992
3188,Désarmement conventionnel et sécurité en Europe,1990,1958-8992
3189,L'Europe des immigrés Dominique Schnapper,1992,1958-8992
3190,Alain Prate. Quelle Europe ?,1991,1958-8992
3191,La négociation sur les Forces armées conventionnelles en Europe,1991,1958-8992
3192,Turgut Ozal. La Turquie en Europe,1989,1958-8992
3193,La sécurité de l'Europe occidentale entre le nucléaire et le conventionnel,1988,1958-8992
3194,Europe / Etats-Unis : le couplage stratégique menacé,1987,1958-8992
3195,Keith Middlemas. Orchestrating Europe,1996,1958-8992
3196,"L'Amérique et l'Europe, réalités et représentations",1986,1958-8992
3197,Nicole Gnesotto. La puissance et l'Europe,1999,1958-8992
3198,Défense économique de l'Europe face au « péril américain »,1997,1958-8992
3199,L'UEM et le nouveau visage de l'Europe : une opinion américaine,1997,1958-8992
3200,La Turquie et les organes politiques du Conseil de l'Europe,1984,2105-2948
3201,La France et la politique américaine à l'égard de la sécurité de l'Europe,1979,1958-8992
3202,Le défi du SS-20 et la stratégie soviétique à l'égard de l'Europe,1979,1958-8992
3203,Livres populaires français et allemands dans l'Europe du Sud-Est,1986,1760-7892
3204,"Europe, n° 659 (mars 1984) : «Le Roman gothique »",1985,1760-7892
3205,Négociation collective et régulation du marché du travail en Europe,2001,1703-8138
3206,Genre et politiques étatiques en Europe centrale et orientale,1999,1705-9240
3207,On Economic Policies of Unemployment in Europe,1999,1703-8138
3208,Réveil de l’ethnicité akan et pentecôtisme ‘indigène’ en Europe,2007,2000-2006
3209,La mortalité infantile en Europe et au Canada : un problème résolu?,1994,1705-1495
3210,Le chômage en Europe : conclusions d’une analyse économétrique multinationale,1992,1710-3991
3211,Le dollar et l’euro : la primauté monétaire de l’Europe a-t-elle une place?,1998,1710-3991
3212,"L’imposition des revenus de l’investissement en Europe, une hétérogénéité coûteuse",1999,1710-3991
3213,Dette externe et structure économique en Europe de l’Est (Note),1988,1703-7891
3214,Europe-Afrique : La relance du développement par l’annulation de la dette,1988,1703-7891
3215,"Partisans de Gorbatchev et partisans du changement en Europe de l’Est, 1985-1989 (Note)",1990,1703-7891
3216,"L'Europe, l'évaluation technologique et la régulation fractale mondiale",1995,1703-7891
3217,Les nationalités minoritaires d'Espagne face à l'Europe,1999,1703-7891
3218,Orphée ressuscité? Un panorama de l’opéra contemporain en Europe,2002,1488-9692
3219,"Liminaire : L’Europe, le laboratoire d’idées du XXIe siècle?",2001,1920-2954
